# episodes,genre,network,rating,s_rating,title,cast,director,screenwriter
32,KoreanDrama Drama Romance Comedy Crime&Mystery,Sbs,9.58,PG-13,Thirty But Seventeen,ShinHyeSun YangSeJong AhnHyoSeop YeJiWon JungYooJin YoonSunWoo WangJiWon LeeSeungJoon ShimYiYoung LeeDoHyun WangSukHyun,JoSooWon,JoSungHee
36,Romance Melodrama KoreanDrama,Sbs,8.73,PG-13,Fates and Furies,JooSangWook LeeMinJung LeeKiWoo SoYiHyun ParkSooAh ChaSooYun LimJiKyu ShimYiYoung JungSooYoung KwonTaeWon YoonHak,JungDongYoon,KangCheolWoong
42,KoreanDrama Drama Romance,Sbs,9.45,PG-13,The Last Empress,ShinSungRok JangNara ChoiJinHyuk ShinEunKyung LeeElijah ParkWonSook YoonDaHoon LeeHeeJin YoonSoYi StephanieLee KimYoonJi TaeHangHo,JooDongMin,KimSunOk
16,Romance KoreanDrama,Tvn,9.56,PG-13,Encounter,ParkBoGum SongHyeKyo JangSeungJo P.O NamGiAe ShinJungGeun KimHyeEun LeeShiHoon MoonSungGeun JeonSoNee BaekJiWon GoChangSuk ChaHwaYun ParkJinJoo,ParkShinWoo,YooYoungA
32,Romance Melodrama Drama KoreanDrama,Sbs,9.55,PG-13,My Strange Hero,YooSeungHo JoBoAh KwakDongYeon YooSeonHo KimDongYoung ParkAhIn KimYeoJin KimMiKyung UhmHyoSup ChunHoJin KimKwangGyu,HamJoonHo,KimYoonYoung
16,KoreanDrama IdolDrama Romance,Tvn,9.72,PG-13,What’s Wrong With Secretary Kim,ParkSeoJoon ParkMinYoung LeeTaeHwan KangKiYoung Chansung PyoYeJin KimHyeOk KimByungOk HwangBoRa LeeYooJoon LeeJungMin KimJungWoon KangHongSeok HongJiYoon KimYeWon,ParkJoonHwa YooJongSun,JungKyungYoon JungEunYoung
16,Romance KoreanDrama,Mbn Dramax,9.15,PG-13,Devilish Joy,ChoiJinHyuk SongHaYoon LeeHoWon LeeJooYeon,KimGaRam,ChoiJiYeon
33,Drama KoreanDrama Comedy Romance,Mbc,9.67,PG-13,I Am Not a Robot,YooSeungHo ChaeSooBin UhmKiJoon HwangSeungEon KangKiYoung SeoDongWon UhmHyoSup KimKiDoo SonByungHo KimMinKyu(1988) KimHaKyoon ParkSeWan LeeMinJi(1988) LeeByungJoon,JungDaeYoon,KimSeonMi
40,KoreanDrama Drama Romance Comedy Thriller&Suspense,Sbs,9.63,PG-13,Suspicious Partner,JiChangWook NamJiHyun ChoiTaeJoon Nara KimYeWon(1987) LeeDeokHwa JangHyukJin NamGiAe JinJuHyung KimHongFa DongHa,ParkSunHo,KwonKiYoung
16,Romance Sports Drama KoreanDrama,Mbc,9.75,PG-13,Weightlifting Fairy Kim Bok Joo,NamJooHyuk LeeSungKyung LeeJaeYoon KyungSooJin ChoiMooSung JungInKi JiIlJoo JangYoungNam KangKiYoung JoHyeJung LeeJooYoung,OhHyunJong,YangHeeSeung
82,Family&Kids KoreanDrama Drama,Kbs,9.03,PG-13,My Only One,Uee LeeJangWoo NaHyeMi YoonJinYi ChoiSooJong ParkSungHoon ImYeJin JungEunWoo ChaHwaYun JinKyung ParkSangWon JungJaeSun,HongSeokKu,KimSaKyung
17,KoreanDrama Romance Drama Thriller&Suspense Sci-Fi&Fantasy,Mbc,9.69,PG-13,W,LeeJongSuk HanHyoJoo LeeTaeHwan JungYooJin LeeSiEon KangKiYoung ParkWonSang KimEuiSung ChaKwangSoo NamGiAe,JungDaeYoon,SongJaeJung
9,Historical Romance KoreanDrama Costume&Period,Tvn,9.73,PG-13,The Crowned Clown,YeoJinGoo LeeSeYoung KimSangKyung JungHyeYoung KwonHaeHyo JangGwang JangYoungNam YoonKyungHo LeeMooSaeng,KimHeeWon,KimSunDeok ShinHaEun
96,Lifestyle&Variety Entertainment VarietyShow,Sbs,9.29,PG-13,Running Man,YooJaeSuk Haha SongJiHyo KimJongKook LeeKwangSoo JiSukJin JunSoMin,LeeHwanJin,JoHyojin KimJoohyung ImHyungtaek
17,Romance KoreanDrama Drama IdolDrama Comedy Sci-Fi&Fantasy,Jtbc,9.77,PG-13,Strong Woman Do Bong Soon,ParkBoYoung ParkHyungSik JiSoo AnWooYeon KimMinKyo YooJaeMyung ShimHyeJin KimWonHae SeolInAh JooHo JangMiKwan ParkBoMi JeonSukHo ImWonHee KimWonSuk,LeeHyeongMin,BaekMiKyeong
23,Romance Sci-Fi&Fantasy KoreanDrama Drama,Sbs,9.6,PG-13,The Legend of the Blue Sea,LeeMinHo JunJiHyun ShinHyeSun LeeHeeJoon ShinWonHo SungDongIl MoonSoRi LeeJiHoon HwangShinHye Jinyoung(GOT7) OhYeonAh,JinHyeok,ParkJiEun
16,Drama KoreanDrama Romance Sci-Fi&Fantasy,Sbs,9.68,PG-13,While You Were Sleeping,LeeJongSuk Suzy JungHaeIn ShinJaeHa LeeSangYeob ParkJinJoo MinSungWook GoSungHee KimWonHae LeeJaeKyoon BaeHaeSun KimDaYe,OhChoongHwan ParkSooJin,ParkHyeRyun
19,KoreanDrama Drama Romance Melodrama MedicalDrama,Kbs,9.75,PG-13,Descendants of the Sun,SongJoongKi SongHyeKyo JinGoo KimJiWon Onew KimMinSuk LeeSeungJoon HyunJyuNi LeeYiKyung DavidMcInnis KangShinIl JiSeungHyun ParkHwanHee KimByungChul AhnBoHyun JoJaeYoon SeoJeongYeon JunSooJin JasperCho,LeeEungBok BaekSangHoon YooJongSun,KimEunSook KimWonSuk
32,IdolDrama KoreanDrama Romance,Sbs,9.24,PG-13,Where Stars Land,LeeJeHoon ChaeSooBin LeeDongGun Rowoon KimJiSoo KimKyungNam LeeSookyung(1996) LeeSungWook HongJiMin JangHyunSung,ShinWooCheol,KangEunKyung
16,Drama KoreanDrama Romance Comedy,Kbs,9.65,PG-13,Oh My Venus,SoJiSub ShinMinAh JungGyuWoon YooInYoung SungHoon HenryLau JungHyeSung KwonKiSun NamGiAe,KimHyungSuk LeeNaJeong,KimEunJi
40,Family&Kids Drama Melodrama KoreanDrama,Mbc,9.15,PG-13,A Pledge to God,HanChaeYoung LeeChunHee OhYoonAh BaeSooBin LeeHwiHyang ParkGeunHyung ByungHun KangBooJa OhHyunKyung KimHeeJung BaeHaeSun ChoiPhillip,YoonJaeMoon,HongYoungHee
20,Historical Romance Drama KoreanDrama IdolDrama,Kbs,9.62,PG-13,Hwarang,"ParkSeoJoon GoAra ParkHyungSik ChoiMinho DoJiHan JoYoonWoo ""KimTaehyung(BTSsV)"" SungDongIl KimJiSoo ChoiWonYoung SeoYeJi LeeDaIn JinJuHyung",YunSeongSik,ParkEunYoung
22,Drama Romance Sci-Fi&Fantasy KoreanDrama,Sbs,9.63,PG-13,My Love From the Star,JunJiHyun KimSooHyun ParkHaeJin YooInNa ShinSungRok AhnJaeHyun NaYoungHee KimKangHyun LeeIlHwa KimBoMi KimHyunSoo,JangTaeYoo OhChoongHwan,ParkJiEun
32,Romance Comedy WebDrama KoreanDrama,Xtvn,9.35,PG-13,Revenge Note 2,Samuel AhnSeoHyun KimSoHee JiMinHyuk KimJiYoung ParkHeeJin SeoYuri ParkSeoYeon SungJiRu JungJungAh JungMinKyu,OhSeungYul SeoJaeJoo,HanSangIm KimJongSun ShimMiSun
25,Comedy KoreanDrama Drama Romance,Kbs2,9.43,PG-13,Boys Over Flowers,LeeMinHo KuHyeSun KimHyunJoong KimBum KimJoon ParkJiBin NamDaReum ParkSooJin KimSoEun KimHyunJoo HanChaeYoung ImJooHwan AhnSukHwan SeoMinJi,YasuharuIshii OsamuKatayama DaisukeYamamuro,YokoKamio YukiFujimoto
32,Drama KoreanDrama IdolDrama Melodrama Thriller&Suspense Romance,Mbc,9.33,PG-13,Tempted,WooDoHwan Joy MoonGaYoung KimMinJae(1996) KimSeoHyung ShinSungWoo JeonMiSun MoonHeeKyung LeeYoungJin OhHaNee TaeHangHo KimAhRa LeeJaeKyoon JungHaDam ShinChangJoo KimDoWan KwonYil,KangIn LeeDongHyun,PierreChoderlosdeLaclos KimBoYeon
20,Action&Adventure Drama KoreanDrama Romance,Kbs,9.77,PG-13,Healer,YooJiTae ParkMinYoung JiChangWook WooHyun JungJunWon KimMiKyung ParkSangMyun ParkSangWon DoJiWon,LeeJungSub KimJinWoo,SongJiNa
52,IdolDrama Romance KoreanDrama Family&Kids Comedy Drama,Kbs,9.69,PG-13,Father Is Strange,LeeYooRi RyuSooYoung LeeJoon JungSoMin RyuHwayoung KimHaeSook KimYoungChul MinJinWoong JungJunWon LeeMiDo AhnHyoSeop LeeJoonHyuk KimDaYe,LeeJaeSang,LeeJungSun
20,Comedy Drama Romance KoreanDrama Melodrama,Mbc,9.56,PG-13,Fated to Love You,ChoiWooShik WangJiWon ChoiJinHyuk JangNara JangHyuk KimYoungHoon ParkHeeBon JungKyuSoo ChoiDaeChul JangGwang ParkJinWoo Clara SongOkSook JungEunPyo LeeMiDo ImHyungJoon ParkWonSook JungHanHun KimYongGun NaYoungHee ParkHeeJin YangKeumSuk YunMiJoo HanGyu,LeeDongYoon KimHeeWon,JooChanOk JoJinKuk
64,Melodrama Drama Family&Kids KoreanDrama,Mbc,8.96,PG-13,My Healing Love,SoYooJin YeonJungHoon YoonJongHoon KimChangWan KilYongWoo JungAeRi ParkJoonGeum HwangYoungHee KwonSoHyun KimSoRa SoJuYeon KangDaHyun BanHyoJung,KimSungYong,WonYoungOk
16,KoreanDrama Romance,Tvn,9.66,PG-13,Because This Is My First Life,LeeMinKi JungSoMin KimGaEun ParkByungEun Esom MoonHeeKyung KimMinSuk JunHyeWon YoonBomi KimSunYoung(1976) KimByungOk NohJongHyun KimMinKyu,ParkJoonHwa,YoonNanJoong
16,Romance Drama KoreanDrama IdolDrama Melodrama,Tvn,9.56,PG-13,The Smile Has Left Your Eyes,SeoInGuk JungSoMin ParkSungWoong SeoEunSoo LeeHongbin DoSangWoo LeeJiMin GoMinSi HanSaMyung ParkMinJung KimSeoKyung JangYoungNam ChoiByungMo KwonSooHyun,YooJeWon,SongHyeJin
20,Drama KoreanDrama Romance,Sbs,9.51,PG-13,Pinocchio,LeePilMo ParkShinHye LeeJongSuk LeeYooBi KimYoungKwang MinSungWook YoonKyunSang LeeJooSeung KimHaeSook KimYoungHoon KimKwangGyu YeoHoeHyun JungInKi NamDaReum ShinJaeHa JangYoungNam ShinJungGeun KangShinIl NohJungUi JinKyung ByunHeeBong TaeHangHo,JoSooWon,ParkHyeRyun
16,KoreanDrama IdolDrama Melodrama Drama Romance,Jtbc,9.63,PG-13,Just Between Lovers,Junho WonJinAh LeeKiWoo KangHanNa KimMinKyu ParkMyungShin ParkHeeBon YoonSeAh KimKangHyun NaMoonHee TaeInHo ParkSiEun(2001) NamDaReum HanSeoJin(2008) AhnNaeSang ParkKyuYoung YoonYooSun NamGiAe KimHyeJoon KimNamJin,KimJinWon,YooBoRa
38,Drama KoreanDrama Comedy Romance Food&Cooking,Sbs,9.36,PG-13,Wok of Love,JangHyuk JungRyeoWon Junho LeeMiSook JoJaeYoon ParkJiYoung ChaJooYoung JangHuiRyoung LeeKiHyuk TaeHangHo KimHyunJun ChaInHa ChoiWonMyeong KimSaKwon ImWonHee OhEuiSik HongYoonHwa,ParkSunHo HamJoonHo,SeoSookHyang
16,Drama KoreanDrama Romance Comedy,Kbs,9.62,PG-13,Fight My Way,ParkSeoJoon KimJiWon AhnJaeHong SongHaYoon JinJiHee ChaeDongHyun PyoYeJin KimSungOh JinHeeKyung SonByungHo KwakDongYeon ChoiWooShik HwangBoRa LeeElijah KimYeRyung,LeeNaJeong,ImSangChoon
20,MedicalDrama Romance KoreanDrama Drama,Sbs,9.3,PG-13,Doctors,KimRaeWon ParkShinHye YoonKyunSang LeeSungKyung JiSoo KimMinSuk BaekSungHyun LeeSunHo JungHaeKyun JeonGookHwan JangHyunSung UhmHyoSup KimKangHyun YoonHaeYoung MoonJiIn YooDaIn KimYoungAe HanBoBae NamgoongMin PyoYeJin,OhChoongHwan ParkSooJin,HaMyungHee
19,Historical KoreanDrama Romance Drama IdolDrama,Kbs,9.63,PG-13,Moonlight Drawn by Clouds,ParkBoGum KimYooJung Jinyoung(B1A4) ChaeSooBin JungHyeSung KwakDongYeon JangGwang ParkChulMin KimSeungSoo ChunHoJin LeeJoonHyuk HeoJungEun TaeHangHo,KimSungYoon BaekSangHoon,YoonYiSoo kk KimMinJung ImYeJin
20,IdolDrama Romance Sci-Fi&Fantasy KoreanDrama,Tvn,9.65,PG-13,Hwayugi,LeeSeungGi ChaSeungWon OhYeonSeo LeeHongKi LeeSeYoung LeeEl KimSungOh SungJiRu JangGwang KimJiSoo SongJongHo SungHyuk MichaelLee ONE Bora LeeSoYeon,ParkHongKyun KimJungHyun KimByungSoo,HongJungEun HongMiRan
32,Thriller&Suspense Romance Crime&Mystery Drama KoreanDrama,Mbc,9.49,PG-13,Come and Hug Me,JangKiYong JinKiJoo HeoJoonHo RyuHanBi NamDaReum ChoiRi YoonJiHye LeeDaIn JungDaHye YoonJongHoon KimKyungNam KwonHyukSoo,ChoiJoonBae,LeeARam
32,Crime&Mystery Thriller&Suspense Drama KoreanDrama,Mbc,9.53,PG-13,Children of Nobody,LeeYiKyung KimSunAh NamGyuRi N NaYoungHee KimYoungJae JooSukTae KimYeoJin YeonJaeHyeong KimPubLae KimYoungJae OhHyeWon HaEunSoo,ChoiJungKyu,DoHyunJung
12,Sci-Fi&Fantasy Romance Comedy,KbsW,9.34,PG-13,When Time Stopped,KimHyunJoong AnJiHyun LeeShiHoo InGyoJin JooSukTae ImHaRyong GoEunMi KimSieun BaekSangHee YooEunJin KimYangWoo,KwakBongCheol,JiHoJin
20,Sci-Fi&Fantasy KoreanDrama Drama Romance Melodrama Comedy,Sbs,9.38,PG-13,Secret Garden,YoonSangHyun HaJiWon HyunBin KimSaRang LeeJongSuk KimSungOh YooInNa LeePhilip KimDongGyoon KangChanYang YoonGiWon KimSaHee ParkJoonGeum Beige KimGun BaekSeungHee ChoiYoonSo KimSungKyum SungByungSook NamHyunJoo KimJiSook JangSeoWon YooSeoJin BaekJiYoung KimMiKyung LeeByungJoon,ShinWooCheol KwonHyukChan KimJungHyun,KimEunSook
12,Sci-Fi&Fantasy Romance Comedy KoreanDrama IdolDrama,ChannelA,8.2,PG-13,"Coffee, Do Me a Favor",YongJunhyung KimMinYoung ChaeSeoJin LeeTaeRi GilEunHye RyuHyeRin MaengSeChang KimNeulMae,ParkSooChul,SeoBoRa LeeAYeon
17,KoreanDrama IdolDrama Romance,Mbn Dramax,8.84,PG-13,"Rich Man, Poor Woman",Suho HaYeonSoo OhChangSuk KimYeWon(1987) LeeJaeJin ParkSungHoon YoonDaYoung,MasakiNishiura RyoTanaka,NaokoAdachi
33,Comedy Romance Drama KoreanDrama Sci-Fi&Fantasy Melodrama,Kbs,9.33,PG-13,Feel Good To Die,BaekJinHee KangJiHwan GongMyung InGyoJin ParkSolMi RyuHyunKyung LeeByungJoon KimMinJae JungMinAh,LeeEunJin,Goldkiwisae ImSeoRa
20,Horror&Supernatural MedicalDrama Sci-Fi&Fantasy Romance KoreanDrama Action&Adventure,Kbs2,9.18,PG-13,Blood,AhnJaeHyun KuHyeSun JiJinHee KimKapSoo RyuSooYoung KwonHyunSang SohnSuHyun JoJaeYoon JungHaeIn,KiMinSoo,ParkJaeBum
24,Comedy KoreanDrama Drama Romance Sci-Fi&Fantasy,Mbc,9.1,PG-13,Goong,KimJeongHoon YoonEunHye JooJiHoon SongJiHyo LeeYoonJi ImYeJin KangNamGil ChoiSungJoon(1983) LeeYeonDoo YoonYooSun ShimHyeJin KimHyeJa JunSooYun WonMiWon LeeHoJae KimSuk LeeEun RyuShiHyun ChoiBoolAm JangMiHee JunJiAe LeeYongJoo ParkChanHwan,HwangInRoe KimDoHyung,InEunA ParkSoHee
13,VarietyShow Entertainment,Mbc,9.44,PG-13,UNDER NINETEEN,KimSoHyun Eunhyuk Solji Crush Gaeko Choiza,[],[]
16,IdolDrama Drama KoreanDrama Romance,Kbs,9.4,PG-13,School 2017,KimSejeong KimJungHyun(1990) JangDongYoon HanSunHwa HanJooWan ParkSeWan Rowoon ChoiSungMin SeolInAh SungJiRu ParkChulMin LeeJaeYong LeeJongWon MinSungWook,ParkJinSuk,JungChanMi KimSeungWon
16,KoreanDrama Romance Thriller&Suspense IdolDrama,Kbs2,9.38,PG-13,Who Are You,KimSoHyun NamJooHyuk YookSungjae LeePilMo KimMinSuk KimBoRa JungSooYoung JungInKi ParkHwanHee LeeDavid,BaekSangHoon,KimHyunJung KimMinJung ImYeJin
32,Drama Romance KoreanDrama Melodrama,Mbc,9.25,PG-13,Hotel King,Alex LeeDaHae LeeDongWook WangJiHye ImSeulong ParkChulMin LeeJooYeon KimYeWon LeeDeokHwa LeeDoYun JiIlJoo KimHaeSook N YooGun GoYoon KimSunYoung(1976) JinTaeHyun ChoiSangHoon GongHyunJoo JungSukYong LeeSangMi KimSunHyuk KimKyuSun GooBonIm SeoYiAhn,KimDaeJin Ashbun,JoEunJung
16,Romance KoreanDrama IdolDrama,Tvn,8.52,PG-13,Mama Fairy and the Woodcutter,MoonChaeWon YoonHyunMin SeoJiHoon KangMina AhnYoungMi GoDooShim JunSooJin HwangYoungHee AhnKilKang KimMinKyu(1988),KimYunCheol,DolBae YooKyungSun
16,Comedy KoreanDrama Drama Romance,Mbc,9.02,PG-13,Playful Kiss,LeeTaeSung LeeSiYoung KimHyunJoong JungSoMin YoonSeungAh AbigailAlderete ChoiWonHong KangNamGil,HwangInRoe KimDoHyung KimJungHyun,KoEunNim KaoruTada
12,Sci-Fi&Fantasy Romance IdolDrama KoreanDrama,Mbn,9.3,PG-13,Witch's Love,HyunWoo YoonSoHee LeeHongbin KimYoungOk GoSooHee ChoiJaeSup ChoiTaeHwan,ParkChanYool,SonEunHye
12,Romance Comedy Action&Adventure WebDrama IdolDrama KoreanDrama,Oksusu,9.33,PG-13,Revenge Note 1,ChaEunWoo ParkSolomon KimHyangGi KimHwanHee JiGeonWoo ParkMiSun LeeDooIl ParkKyungLim HwangTaeKwang,SeoWonTae,HanSangIm KimJongSun
20,Comedy Romance MedicalDrama KoreanDrama,Mbc,9.73,PG-13,Kill Me Heal Me,OhMinSeok KimYooRi ParkSeoJoon HwangJungEum JiSung ChoiWonYoung LeeSiEon KimHeeJung GoChangSuk AhnNaeSang ParkJoonGyu,KimJinMan,JinSooWan
17,Horror&Supernatural Romance Sci-Fi&Fantasy KoreanDrama,Sbs,9.57,PG-13,Master’s Sun,SoJiSub KimYooRi SeoInGuk GongHyoJin KimMyungSoo(L) SeoHyoRim KimJiHan KimYongGun LeeChunHee HwangSunHee KimMiKyung KimHeeJung LeeJongWon YooKyungAh ParkHeeBon ChoiJungWoo JungGaEun HanBoReum LeeYongNyeo KimBoRa LeeJaeWon,JinHyeok,HongJungEun HongMiRan
60,KoreanDrama Drama Costume&Period Romance Biography,Mbc,9.55,PG-13,Dong Yi,JiJinHee HanHyoJoo BaeSooBin OhYeonSeo LeeSoYeon KimHyeSun JungDongHwan LeeKwangSoo ChunHoJin ParkHaSun JungEunPyo KimYooJung ChoiSooHan JungJinYoung KwonMin JungSungYoon ChoiChulHo ChoiJongHwan JungInKi ParkJungSoo OhEunHo LeeJaeYong MaengSangHoon NamDaReum BanMinJung JungYuMi(1984) YeoHoMin LeeHeeDo ChoiHaNa MinJoonHyun KimYooSuk ChoiIlHwa NaSungKyoon LeeKyeIn(Yi KangYooMi LeeHyungSuk KimDongYoon YeoHyunSoo ShinGook ChoiJaeHo SonIlKwon HanDaMin KimHyeJin ImSungMin JungSunIl LeeJungHoon LeeSook HeoYiSeul JungKiSung ChoiRan,LeeByungHoon KimSangHyub,KimYiYoung
17,Comedy KoreanDrama Drama Romance Food&Cooking,Mbc,9.43,PG-13,Coffee Prince,LeeSunGyun ChaeJungAn KimJaeWook YoonEunHye GongYoo KimDongWook,LeeYoonJung,LeeJungA JangHyunJoo
16,KoreanDrama Romance,Mbn,8.27,PG-13,Love Alert,YoonEunHye ChunJungMyung HanGoEun JooWooJae P.O LeeHaeRan KimByungGi OhMiHee KimYeRyung ChoiChulHo ChoiJungWon ChoHyunYoung,JoChangWan,SeoHanKyeol KimShinHye
11,Family&Kids Drama KoreanDrama IdolDrama Comedy,Mbn Dramax,8.91,PG-13,The Best Chicken,KimSoHye(I.O.I) ParkSunHo JooWooJae SonMinJi Hongseok JoAhYoung HongSoonChang LeeSeungHyup KimSeoRa NaJongChan MyungKyeNam,LeeSeungHoon,ParkChanYoung
20,Comedy Romance Sci-Fi&Fantasy KoreanDrama IdolDrama,Kbs,9.24,PG-13,Hi! School - Love On,Woohyun KimSaeRon Sungyeol LeeJoonHyuk KimMinSuk Fabien,SungJoonHae,LeeJaeYeon
16,KoreanDrama Romance Drama,Sbs,9.16,PG-13,To the Beautiful You,ChoiMinho Sulli KangHaNeul LeeHyunWoo KangKyungJoon Yura Kwanghee AhnHyeKyung JulienKang LeeAhHyun ChoiJongYoon LeeHanWi YooMinKyu SeoJunYoung JungYooGeun KiTaeYoung KimIan JiSoo KimJiWon SunWooJaeDuk LeeYoungEun,JeonKiSang,HisayaNakajo LeeYoungChul
55,VarietyShow Entertainment Comedy,Sbs,9.75,PG-13,Master in the House,YookSungjae LeeSeungGi LeeSangYoon YangSeHyung,[],[]
16,Comedy Drama Romance KoreanDrama,Mbc,9.39,PG-13,Cunning Single Lady,JooSangWook LeeMinJung SeoKangJoon KimMyungSoo(L) KimKyuRi LeeByungJoon OhNaMi KwonKiSun YooYoung WangBitNa LeeJongSoo ChoiKyuHwan HwangBoRa YangHeeKyung YumDongHun KimDaHyun KimYongHee KimHoYoung ImJiEun RickyKim LeeJungGil InGyoJin GoInBum KimYeRyung ChoiChulHo KimEungSoo,KoDongSun JungDaeYoon,LeeHaNa ChoiSooYoung
16,Drama KoreanDrama Melodrama Romance Comedy IdolDrama,Kbs,9.27,PG-13,Radio Romance,YoonDooJoon KimSoHyun YoonPark Yura KwakDongYeon LimJiKyu HaJun JoByeongGyu ShimEunWoo(1992) YoonJooSang LeeYiWoong JungHeeTae JeonYooRim RyuHyeRin YoonJinSol ParkHyoJoo KimYeRyung AhnDoGyu KimHyeJi OhHyunKyung LeeWonJong KimByungSe,KimShinIl,JeonYooRi
190,Lifestyle&Variety Entertainment Reality VarietyShow,Kbs,9.03,PG-13,The Return of Superman,LeeBeomSoo LeeHwiJae KiTaeYoung LeeDongGook OhJiHo YangDongGeun InGyoJin ChooSungHoon SongIlGook UhmTaeWoong Eugene SoYiHyun,[],[]
50,KoreanDrama Romance Drama Food&Cooking,Mbc,8.93,PG-13,A Hundred Years' Inheritance,LeeJungJin YoonAhJung Eugene ShinGoo KwonOhJoong ShimYiYoung LeeHyunWoo(1966) JungHyeSun ChoiWonYoung JunInHwa SunWooSun,JooSungWoo,KooHyunSook
20,KoreanDrama Drama Romance Costume&Period Sci-Fi&Fantasy Historical,Mbc,9.54,PG-13,The Moon Embracing the Sun,HanGaIn KimSooHyun JungIlWoo SongJaeRim ImSiwan KimYoungAe LeeWonGeun YeoJinGoo LeeTaeRi AhnNaeSang KimSoHyun YoonSeungAh BaeNooRi KimYooJung,KimDoHoon LeeSungJoon,JungEunGwol JinSooWan
16,Sci-Fi&Fantasy Romance Drama KoreanDrama,Tvn,9.01,PG-13,About Time,LeeSungKyung LeeSangYoon ImSeMi KimDongJun KimHaeSook NaYoungHee HanSeungYeon Rowoon KimSaHee YuXiaoGuang KangKiDoong KimKyuRi JungMoonSung,KimHyeongSik,ChuHyeMi
20,Drama Romance KoreanDrama MedicalDrama Melodrama Thriller&Suspense,Sbs,9.06,PG-13,Doctor Stranger,LeeJongSuk Bora ParkHaeJin JinSeYeon KangSora ParkHaeJoon ChunHoJin WonJongRye GooSeungHyun KimSangHo UhmSooJung ChoiJungWoo KangYeWon JeonGookHwan JungInKi SungByungSook KimYongGun NamMyungRyul HwangBumShik KangPhilSun,JinHyeok,ParkJinWoo
16,KoreanDrama Action&Adventure Crime&Mystery,Tvn,9.67,PG-13,Lawless Lawyer,LeeJoonGi SeoYeJi LeeHyeYoung(1962) ChoiMinSoo YeomHyeRan ChaJungWon JeonJinKi ShinEunJung AhnNaeSang LeeHanWi LeeDaeYeon,KimJinMin,YoonHyunHo
16,KoreanDrama Romance Drama,Tvn,8.73,PG-13,Cheese In The Trap,ParkHaeJin KimGoEun SeoKangJoon LeeSungKyung NamJooHyuk ParkMinJi KimHeeChan SonByungHo AhnKilKang YoonBokIn KimKiBang MoonJiYoon OhHeeJoon JiYoonHo YoonJiWon ChaJooYoung YoonYeJoo,LeeYoonJung,SoonGgi KimNamHee
20,Drama KoreanDrama Romance IdolDrama Comedy,Sbs,9.46,PG-13,Dear Fair Lady Kong Shim,NamgoongMin Minah SeoHyoRim OnJooWan OhHyunKyung KimByungOk JungHyeSun KyunMiRi WooHyun KimIlWoo ParkSiEun(2001),BaekSooChan,LeeHeeMyung
32,Comedy Drama KoreanDrama Romance,Sbs,9.14,PG-13,The Undateables,NamgoongMin HwangJungEum ChoiTaeJoon OhYoonAh ShimHyeJin LeeMoonShik JoDalHwan JungMoonSung LeeJooYeon,KimYooJin,LeeJaeYoon
79,Entertainment VarietyShow Comedy Reality,Mbc,9.3,PG-13,Home Alone,LeeSiEon ParkNaRae JunHyunMoo HenryLau YoonHyunMin,Writer:KimDoHyun,KimDoHyun
16,Drama KoreanDrama Romance Comedy,Mbc,9.51,PG-13,Shopping King Louie,SeoInGuk NamJiHyun YoonSangHyun ImSeMi KimYoungOk UhmHyoSup KimKyuChul HwangYoungHee KimByungChul LeeJaeKyoon OhDaeHwan,LeeSangYeob,OhJiYoung
16,Drama KoreanDrama Action&Adventure Romance,Tvn,9.33,PG-13,The K2,JiChangWook SongYoonAh Yoona JoSungHa SonTaeYoung JoDongHyuk KimKapSoo LeeJungJin LeeYeEun,KwakJungHwan,JangHyeokRin
21,Comedy Drama Romance KoreanDrama,Tvn,9.19,PG-13,Emergency Couple,ChoiJinHyuk SongJiHyo LeePilMo ChoiYeoJin ParkJiIl JunSooKyung JunSooJin ParkDooShik YoonJongHoon Clara ParkJoonGeum KwonMin ChoiBumHo KimKangHyun KangShinIl LeeMiYoung ImHyunSung LeeSunAh,KimCheolKyu,ChoiYoonJung
52,Drama KoreanDrama Melodrama Romance,Kbs,9.26,PG-13,My Golden Life,ParkShiHoo ShinHyeSun LeeTaeHwan SeoEunSoo YooInYoung LeeTaeSung JeonNoMin KimHyeOk ChunHoJin NaYoungHee ChoiGwiHwa ShinHyunSoo,KimHyungSuk,SoHyeonKyeong
187,Comedy Entertainment Reality VarietyShow Travel,Kbs,9.49,PG-13,2 Days and 1 Night,ChaTaeHyun JungJoonYoung KimJongMin Defconn KimJoonHo YoonShiYoon,[],[]
16,Comedy KoreanDrama Drama Romance IdolDrama Music,Sbs,9.23,PG-13,You’re Beautiful,LeeHongKi ParkShinHye JungYongHwa Uee JangGeunSuk KimSungRyung JungChan KimInKwon JangWonYoung KangSooHan ChoiRan BaeGeuRin,HongSungChang,HongJungEun HongMiRan
82,Entertainment VarietyShow Comedy Reality,Sbs,9.29,PG-13,My Little Old Boy,ParkSooHong KimJongKook TonyAn KimGunMo LeeSangMin LeeSunMi JiInSook LimYeoSoon LeeOkJin ChoHyeSun ShinDongYup SeoJangHoon,KwakSeungyeong ChoiSohyeong RyuJihwan,YookSoyoung KangSeunghui ChoiSeungyeon SinYujin YeonChorong KimJiye KimHyeonjin ChoiNamu
54,KoreanDrama Melodrama Drama Family&Kids Comedy,Kbs,9.65,PG-13,Five Children,AhnJaeWook SoYooJin SungHoon ShinHyeSun ShimHyungTak ImSooHyang AnWooYeon ShimYiYoung WangBitNa KwonOhJoong,KimJungKyu,JungHyunJung
10,WebDrama KoreanDrama IdolDrama,NaverTv,8.71,PG-13,Wind-bell,"""KwonMina(AoAsMinA)"" Jinyoung(B1A4) ParkHyunSook YoonJiWook LeeSeungWook",[],[]
13,Romance KoreanDrama,ChannelA,8.2,PG-13,Twelve Nights,ShinHyunSoo HanSeungYeon JangHyunSung LeeGunWoo KimBumJin HwangSoHee KimLeeKyung ChaSooYun YeSooJung LeeYeEun HongJinKi YooJunHong,OiWahLam,OiWahLam
18,Thriller&Suspense KoreanDrama Action&Adventure Drama Sci-Fi&Fantasy,Sbs,9.41,PG-13,I Hear Your Voice,LeeJongSuk LeeBoYoung YoonSangHyun JungWoongIn LeeDaHee GooSeungHyun HanKiWoong YoonJooSang HanKiWon JoDukHyun AhnMoonSook ParkDooShik YeoHoMin JungDongHwan KimKwangGyu KimByungOk KimSooYun ChoiSungJoon(1983) JungMinAh LeeJungHyuk KimKiChun KimSoHyun KimMiKyung KimHaeSook JangHeeWoong KimGaEun JangHeeSoo KimSooYeon,JoSooWon,ParkHyeRyun
16,Drama KoreanDrama Women,Mbc,9.51,PG-13,Angry Mom,KimHeeSun KimYooJung JiHyunWoo Baro JiSoo ParkSooAh KimTaeHoon ImHyungJoon GoSooHee JeonGookHwan OhYoonAh ParkYoungGyu SuhJiHee KangMoonYoung,Ashbun,KimBanDi
20,Comedy KoreanDrama Romance Drama Sci-Fi&Fantasy,Sbs,8.87,PG-13,"Hyde, Jekyll, Me",SungJoon Hyeri HyunBin HanJiMin LeeDeokHwa LeeWonGeun LeeSeungJoon LeeJoonHyuk KwakHeeSung,JoYoungGwang ParkShinWoo,LeeChoongHo KimJiWoon
20,IdolDrama Romance KoreanDrama Family&Kids Comedy Drama,Tvn,9.63,PG-13,Reply 1988,Hyeri ParkBoGum RyuJunYeol GoKyungPyo LeeDongHwi RyuHyeYoung AhnJaeHong ChoiSungWon SungDongIl LeeIlHwa RaMiRan KimSungKyun ChoiMooSung KimSunYoung(1976) YooJaeMyung LeeMinJi(1988) LeeSeYoung(1989),ShinWonHo,LeeWooJung
51,Historical Drama KoreanDrama,Mbc,9.24,PG-13,The Flower in Prison,GoSoo JinSeYeon JungJoonHo ParkJooMi KimMiSook YoonJooHee ChoiTaeJoon KimSooYun JungEunPyo ParkGilSoo Shorry JungDaBin(2000) LeeHeeDo KimHyungBum OhNaRa KimMinKyung KimSooYeon,LeeByungHoon,ChoiWanKyu
83,VarietyShow Reality Entertainment Comedy,Sbs,9.26,PG-13,Law of the Jungle,KimByungMan,MinSeonhong KimJinho BaekSoojin,
20,Drama KoreanDrama MedicalDrama Melodrama,Kbs2,9.63,PG-13,Good Doctor,KimYoungKwang KimMinSeo JooSangWook MoonChaeWon JooWon JinKyung GoChangSuk KimHyunSoo JungManSik KwakJiMin YoonYooSun JoHeeBong ChoiRoWoon KimChangWan ChunHoJin WangJiWon NaYoungHee YooHaeJung BanMinJung KwakDoWon YoonPark MoonHeeKyung UhmHyunKyung JungYoonSuk SeoHyunChul LeeKiYeol JungHoKeun,KiMinSoo KimJinWoo,ParkJaeBum
16,Romance KoreanDrama Drama IdolDrama Melodrama,Sbs,8.55,PG-13,High Society,SungJoon Uee ParkHyungSik LimJiYeon LeeSangWoo,ChoiHyeongHun,HaMyungHee
50,Drama Family&Kids Romance KoreanDrama,Kbs,8.89,PG-13,Marry Me Now,LeeSangWoo HanJiHye YeoHoeHyun ParkJoonGeum ParkSunYoung JangMiHee YooDongGeun ChoiJungWoo KimMiKyung JungChaeYeon KimKwon ParkSeWan ParkSangMyun ChoiDaeChul HwangDongJoo LeeJiHoon(1979) KimYeRyung GeumSaeRok KangSungWook KimYoonKyung SeoYeonWoo KimWooHyuk,YoonChangBeom,ParkPilJoo
32,Action&Adventure Crime&Mystery KoreanDrama Drama Thriller&Suspense,Mbc,9.03,NC-17,Less than Evil,ShinHaKyun LeeSeol Baro BaeDaBin HongEunHee KimGunWoo BaeYooRam ParkHoSan YangGiWon,KimDaeJin,HeoJoonWoo KangYiHun
16,Lifestyle&Variety Drama Food&Cooking KoreanDrama Comedy Melodrama IdolDrama,Mbc,9.09,PG-13,"Jang Geum, Oh My Grandma",ShinDongWook KwonYuri KimHyunJoon LeeYulEum KiDoHoon LeeMinhyuk JeongYiRang LeeHyeJung KimKiRi,SunHyeYoon,ParkEunJung ChoiWooJoo
10,Documentary Lifestyle&Variety Reality,Tvn,9.2,PG-13,Little House in the Forest,ParkShinHye SoJiSub,NaYoungSeok,
18,Family&Kids Drama KoreanDrama,Kbs,8.65,PG-13,Liver or Die,LeeSiYoung OhJiHo JeonHyeBin YooJoonSang LeeChangYeob ShinDongMi ParkInHwan SongJongHo ChoiDaeChul ChoiSungJae LeeSangSook LeeBoHee KimJiYoung KiEunSe,JinHyungWook,MoonYoungNam
32,Horror&Supernatural Thriller&Suspense Romance KoreanDrama Drama,Kbs,9.06,PG-13,Lovely Horribly,ParkShiHoo SongJiHyo LeeGiKwang HamEunJung ChoiYeoJin JiSeungHyun MoonSuBin JangYoungNam HwangSunHee SungDooSup JeonBaeSoo,KangMinKyung,ParkMinJoo
20,Comedy KoreanDrama Drama Romance Costume&Period IdolDrama,Kbs2,9.38,PG-13,Sungkyunkwan Scandal,SongJoongKi SeoHyoRim YooAhIn ParkMinYoung ParkYoochun AhnNaeSang KimMiKyung LeeTaeRi KimKapSoo JoSungHa JunTaeSoo RyuDam ParkChulMin LeeJaeYong ImYoonJung NamMyungRyul KimIkTae JooAhSung JangSeHyun KimHaKyoon KimKwangGyu KimMinSeo LeeIn KimJungKyoon KimDongYoon ChaeByungChan HanYun HwangChanWoo LeeDalHyung ImYoungPil ParkGeunSoo KangSungPil JungHyeMi BangJoonSeo ChoiDongJoon ParkDongBin KimYoungBae SungHyunJoo KimDanYool,KimWonSuk HwangInHyuk,KimTaeHee JeongEungWol
21,Drama MedicalDrama Romance KoreanDrama,Sbs,9.61,PG-13,Romantic Doctor Kim,HanSukKyu YooYeonSeok SeoHyunJin KimMinJae(1996) JinKyung ImWonHee KimHongFa ByunWooMin JangHyukJin LeeYoungE YangSeJong,YuInSik ParkSooJin,KangEunKyung
