# episodes,genre,network,rating,s_rating,title,cast,director,screenwriter
16,Comedy Drama Romance KoreanDrama,Mbc,8.95,PG-13,Warm and Cozy,YooYeonSeok KangSora LeeSungJae GoKyungPyo LeeYoungE KimSungOh Jinyoung(B1A4),ParkHongKyun KimHeeWon,HongMiRan HongJungEun
30,Melodrama Romance KoreanDrama Drama,Mbc,9.41,PG-13,Can You Hear My Heart?,KimJaeWon GoJunHee NamgoongMin HwangJungEum LeeKyuHan YounYuhJung LeeHyeYoung(1962) HwangYoungHee KimKwangGyu KimYeoJin LeeSungMin KimSaeRon SeoYoungJoo JungBoSuk KangMoonYoung SongSeungHwan,KimSangHo,MoonHeeJung
20,Drama KoreanDrama,Kbs,9.51,PG-13,Neighborhood Lawyer Jo Deul Ho,ParkShinYang KangSora RyuSooYoung ParkSolMi KimDongJun KimKapSoo KangShinIl JoHanChul JungWonJoong HwangSeokJeong ParkWonSang JangSoYeon YoonBokIn HeoJungEun LeeYoungE,LeeJungSub,Haechoolring LeeHyangHee
176,Reality VarietyShow Entertainment Comedy,Kbs,8.48,PG-13,Happy Together,,[],[]
24,KoreanDrama Family&Kids Melodrama Drama Romance,Mbc,8.93,PG-13,"My Husband, Mr. Oh!",KimKangWoo Uee JungSangHoon HanSunHwa ParkMinJi ParkJungSoo JungChan HanSangJin KimBoMi SeolJungHwan JunMooSong JungSooYoung KimHyunKyoon OhMiYun BangEunHee YooJiSoo KimMinShik ChoChangKeun KimJungPal ParkHyeJin,BaekHoMin,YooYoonKyung
50,Family&Kids Comedy Romance Drama KoreanDrama,Mbc,9.23,PG-13,"Bad Thief, Good Thief",JiHyunWoo Seohyun ImJooEun KimJiHoon JangGwang JungKyungSoon ShinEunJung AhnKilKang KimJungTae ChoiJongHwan Shorry ByunJungSoo HanJaeSuk(1991),OhKyungHoon JangJoonHo,SonYoungMok ChaYiYoung
20,KoreanDrama Romance Drama,Kbs2,8.73,PG-13,Babyfaced Beauty,DanielChoi KimMinSeo RyuJin OhYeonSeo JangNara KimKyuChul Clara KimHyeOk NaYoungHee ParkChulMin HyunYoung AhnSeoHyun YoonJooSang YoonHeeSuk KimMiKyung LeeSeungHyung YooTaeWoong JungJooEun YooYunJi SonHwaRyung,LeeJinSeo LeeSoYeon,OhSunHyung JungDoYoon
22,IdolDrama MedicalDrama Sci-Fi&Fantasy KoreanDrama Costume&Period Drama,Mbc,8.84,PG-13,Dr. Jin,SongSeungHeon ParkMinYoung KimJaejoong LeeBeomSoo LeeSoYeon Fabien KimMyungKook LeeSeungJoon KimKwangSik JoMiRyung JungEunPyo KimByungChoon KimDongSuk NoEul LeeHyungSuk,HanHee OhHyunJong,MotokaMurakami HanJiHoon JeonHyeonJin
61,Drama KoreanDrama Romance Melodrama Family&Kids,Sbs,8.43,PG-13,Our Gap Soon,SongJaeRim KimSoEun ChoiDaeChul LeeWan YangJungWon YooSun LeeBoHee LeeByungJoon KimHyeSun KimKyuRi JeonGookHwan JangYong GoDooShim LeeMiYoung,BooSungChul,MoonYoungNam
32,KoreanDrama Comedy Drama Romance,SbsPlus,8.75,PG-13,Full House Take 2,ParkKiWoong HwangJungEum NoMinWoo,KimJinYoung NamKiHoon,ParkYoungSook
16,KoreanDrama Romance Drama IdolDrama Melodrama,Sbs,9.2,PG-13,"That Winter, The Wind Blows",JoInSung SeoHyoRim KimBum JungEunJi SongHyeKyo GoInBum ChoiSeungKyeong ImSeMi KimTaeWoo KimYoungHoon BaeJongOk KimKyuChul,KimKyuTae,NoHeeKyung
38,Romance KoreanDrama Drama,Mbc,9.15,PG-13,May Queen,KimJaeWon HanJiHye JaeHee SonEunSeo KimYooJung BaekSeungHee KimKyuChul ParkJiBin SunWooJaeDuk LeeDeokHwa GoInBum AhnNaeSang YangMiKyung YoonJongHwa YangOhnYoo SeoYoungJoo MoonJiYoon ParkGunTae KimJiYoung(1974) GeumBoRa KimDongHyun KangJiWoo JungHyeWon YoonJungEun LeeHoon BaeSungJong,BaekHoMin,SonYoungMok
24,Sci-Fi&Fantasy KoreanDrama Costume&Period,Mbc,8.63,PG-13,The Night Watchman,JungYunho SeoYeJi JungIlWoo GoSungHee LeeSeChang KimHeungSoo ChoiWonYoung AhYoung JoDalHwan YoonTaeYoung KimSungOh HwangSeokJeong GoChangSuk LeeJaeYong AhnJungHoon SeoYiSook ShimEunJin YooDaIn LeeChaeMi KangJiWoo MoonBoRyung SongYiWoo KimSoYun(2002),LeeJooHwan,YooDongYoon
40,Comedy KoreanDrama Women,Mbc,9.36,PG-13,The Legendary Witch,HaSeokJin HaYeonSoo OhHyunKyung GoDooShim HanJiHye DoSangWoo LeeJongWon ParkGeunHyung LeeSeungJoon JunInHwa TaeHangHo,JooSungWoo,KooHyunSook
18,KoreanDrama Thriller&Suspense Drama Crime&Mystery IdolDrama,Sbs,9.72,PG-13,Defendant,UhmKiJoon UhmHyunKyung JiSung KwonYuri OhChangSuk KimMinSuk JoJaeYoon SonYeoEun OhYeonAh OhDaeHwan,JoYoungGwang,ChoiSooJin
32,Drama KoreanDrama Crime&Mystery Thriller&Suspense,Mbc,8.94,PG-13,Partners for Justice,JungJaeYoung JungYuMi(1984) LeeYiKyung ParkEunSuk StephanieLee OhManSeok,NoDoCheol,MinJiEun WonYoungSil
24,Action&Adventure Romance Sci-Fi&Fantasy KoreanDrama Costume&Period IdolDrama,Mbc,9.6,PG-13,Gu Family Book,YooYeonSeok Suzy ChoiJinHyuk LeeSeungGi JungJoonWon LeeDavid LeeYooBi UhmHyoSup LeeYeonHee KimDongGyoon LeeSungJae KimKiBang JoJaeYoon YooDongGeun JungHyeYoung KimHeeJung KimBoMi YumDongHun NamHyunJoo SongYoungKyu YoonSeAh JinKyung DavidMcInnis JoSungHa KimHeeWon SungJoon JoMinAh LeeDoKyung JangJoonYoo LeeHyeIn SonGaYoung KimSoYun(2002) ParkJooHyung,ShinWooCheol KimJungHyun,KangEunKyung
24,Action&Adventure KoreanDrama Costume&Period Drama,Kbs2,9.42,PG-13,Inspiring Generation,ImSooHyang KimHyunJoong JinSeYeon SongJaeRim YoonHyunMin KimJaeWook ShinSeungHwan JoDalHwan KimGaEun BaeNooRi KwakDongYeon JungHoBin KimJaekyung KimKapSoo JoDongHyuk SonByungHo KimSeJung ImHyungJoon KimDongHee KimByungGi YangIkJoon LeeHaeIn ParkChulMin MoonHeeKyung KimSungOh LeeChoHee ChoiJaeSung KimSuhKyung KimRoeHa ChoiChulHo JungJin YooTaeWoong ChoiIlHwa LeeChulMin JiWoo YeoHoMin JooDaYoung ShinEunJung KwakSeungNam KimMinHa JiSeungHyun,KimJungKyu,BangHakKi ChaeSeungDae ParkKyeOk
20,Historical KoreanDrama Romance Horror&Supernatural Sci-Fi&Fantasy Drama Thriller&Suspense,Mbc,9.42,PG-13,The Scholar Who Walks the Night,LeeJoonGi LeeYooBi ShimChangmin KimSoEun LeeSooHyuk LeeHyunWoo JangSeungJo LeeSoonJae ChoiTaeHwan JangHeeJin,LeeSungJoon,JoJooHee HanSeungHee JangHyunJoo
17,Crime&Mystery Romance Drama KoreanDrama Melodrama Thriller&Suspense,Sbs,9.39,PG-13,Whisper,LeeBoYoung LeeSangYoon KwonYool ParkSeYoung YoonJooHee KimKapSoo JoDalHwan KimSeoRa KangShinIl KimHongFa KimHaeSook LeeHyunJin KimChangWan ChaeDongHyun WonMiKyung,LeeMyungWoo,ParkKyungSoo
32,Drama KoreanDrama Crime&Mystery Romance Action&Adventure,Mbc,8.73,PG-13,Two Cops,KimSeonHo JoJungSuk Hyeri ImSeMi LeeHoWon LeeSiEon ParkHoon ChoiIlHwa JungHaeKyun,KangWooSuk,SungHongKim
20,Drama Romance KoreanDrama Melodrama,Sbs,9.08,PG-13,Angel Eyes,LeeSangYoon NamJiHyun KangHaNeul KuHyeSun KimJiSuk KangDongYup HyunJyuNi KimHwanHee JungAeRi ImSeungDae ShinHyeSun KimSeungWook ParkJinJoo KimYeoJin KwonHaeHyo SeoDongWon JungJinYoung GongHyungJin SuhTaeHwa LeeSeungHyung Seungri,ChoiMunSeok ParkShinWoo,YoonJiRyeon
14,Music KoreanDrama Drama Romance IdolDrama,ChannelA,8.75,PG-13,K-POP Extreme Survival,ParkYooHwan KoEunAh JoYoonWoo SongSeHyun HongKyungMin Ali Kevin JinHyuk,LeeJungPyo,MoonSunHee
13,Drama KoreanDrama Comedy Romance,Kbs,8.35,PG-13,THE Producers,KimSooHyun IU ChaTaeHyun GongHyoJin RyuJunYeol KimJongKook LeeJooSeung,SeoSooMin PyoMinSoo,ParkJiEun
32,Family&Kids Romance KoreanDrama Drama,Kbs,9.15,PG-13,Matrimonial Chaos,ChaTaeHyun BaeDoona LeeEl SonSeokGu ChoiJungWoo NamGiAe JungJiSoon YooHyungKwan HwangJungMin KimHyeJoon MoonSook,YooHyunKi,MoonJungMin
18,Comedy KoreanDrama Drama Romance,Sbs,9.12,PG-13,Protect the Boss,KimJaejoong ChoiKangHee JiSung WangJiHye HaJaeSook ParkYoungGyu OhHeeJoon AhnNaeSang LeeHeeJin ChaHwaYun KimChung JungKyuSoo KimYoungOk KimHyungBum,SonJungHyun,KwonKiYoung
20,Drama KoreanDrama IdolDrama MedicalDrama,Mbc,8.96,PG-13,Medical Top Team,KwonSangWoo JungRyeoWon JooJiHoon OhYeonSeo ChoiMinho LeeDaeYeon KimChung JoWooRi KimKiBang KalSoWon LeeHeeJin ParkWonSang GoWonHee JeonNoMin KimYoungAe ParkJinWoo Alex LeeHanNa AhnNaeSang KimSungKyum KimJungHak,KimDoHoon,YoonKyungAh
16,KoreanDrama Romance Drama Comedy,Kbs,8.89,PG-13,My Fair Lady,YoonEunHye YoonSangHyun MoonChaeWon JungIlWoo KimYoungKwang,YeongsuJi,YoonEunKyung KimEunHee
32,Food&Cooking KoreanDrama Drama,Mbc,8.52,PG-13,Feast of the Gods,LeeSangWoo SeoHyunJin JooSangWook JunInHwa SungYuri UhmHyoSup SeanDulake ShinGoo JungMinAh KimBoYun LeeIlHwa SongMinJung ParkSangMyun ParkJungMin JooDaYoung JungHyeSun OhNaRa JinTaeHyun SeoYiSook JungDongHwan LeeMinJi SonHwaRyung,LeeDongYoon,JoEunJung
34,Thriller&Suspense Crime&Mystery Drama KoreanDrama,Sbs,8.7,PG-13,Return,LeeJinWook ParkJinHee ShinSungRok YoonJongHoon SonJongHak BongTaeGyu JungEunChae ParkKiWoong KimDongYoung OhDaeHwan KimHeeJung(1992) HanDaGam SeoHyeRin,JooDongMin,ChoiKyungMi
16,Romance Drama KoreanDrama,Kbs,9.42,PG-13,On the Way to the Airport,LeeSangYoon KimHaNeul ShinSungRok ChoiYeoJin JangHeeJin SonJongHak,KimCheolKyu,LeeSookYun
20,Comedy KoreanDrama Drama Romance Sci-Fi&Fantasy IdolDrama,Sbs,9.4,PG-13,Rooftop Prince,LeeTaeSung HanJiMin ParkYoochun LeeTaeRi ChoiWooShik KimSoHyun AhnSukHwan JungSukWon AhnSangTae ChoiWonHong LeeMoonShik GuzalTursunova JungYuMi(1984) BanHyoJung KimDaeHee KimHyungBum JunMinSeo KangByul KyunMiRi ParkJoonGeum MaengSangHoon KimYooSuk SongJaeHee SongOkSook NaYoungHee KilYongWoo,ShinYoonSub AhnGilHo,LeeHeeMyung
18,Drama KoreanDrama Comedy Music IdolDrama,Sbs,9.18,PG-13,Entertainer,JiSung Hyeri KangMinHyuk ChaeJungAn ByungHun GongMyung JeonNoMin JungManSik AhnNaeSang HeoJoonSuk,HongSungChang,YooYoungA
10,Romance Sci-Fi&Fantasy KoreanDrama Comedy,Tvn,8.62,PG-13,Surplus Princess,SongJaeRim JoBoAh OnJooWan KimSeulGi ParkJiSoo NamJooHyuk JangKiYong JinHeeKyung JungChanWoo,BaekSeungRyong,ParkRan KimJiSoo
22,Drama Romance Costume&Period KoreanDrama Historical Action&Adventure,Kbs,9.2,PG-13,Gunman In Joseon,LeeJoonGi NamSangMi YooOhSung JeonHyeBin HanJooWan KimGaEun KimHyunSoo,KimJungMin,KiSeungTae
3,WebDrama ShortFilms KoreanDrama Drama,Kbs,9.59,PG-13,Page Turner,JiSoo KimSoHyun ShinJaeHa YeJiWon HwangYoungHee,LeeJaeHoon,ParkHyeRyun
44,Romance KoreanDrama Drama,Mbc,9.08,PG-13,Kimcheed Radish,KimSeungSoo YooHoJung JooSangWook ParkShinHye LeeMinJung KimHeungSoo,KwonSeokJang,LeeDeokJae
13,VarietyShow Entertainment,Sbs,9.09,PG-13,The Master Key,KangDaniel OngSeongWoo ChaEunWoo BaekHyun(EXO) LeeHongKi KimSejeong LeeSooGeun JunHyunMoo JoBoAh ShinWoo ParkSungGwang P.O KangHanNa Shownu KimJongMin Mingyu Jinyoung(B1A4) LeeSungJong HenryLau JungChaeYeon Eunhyuk Hani Chansung LeeElijah Bobby Leeteuk,[],[]
16,Drama Romance KoreanDrama Melodrama,Jtbc,9.2,PG-13,Secret Love Affair,YooAhIn KyungSooJin ParkHyukKwon KimHyeEun KimHeeAe KimChangWan KimYongGun KimKwon ShimHyeJin ChoiTaeHwan JangHyunSung LeeKanHee,AnPanSeok,JungSungJoo
12,Comedy Drama IdolDrama KoreanDrama,Kbs,9.58,PG-13,Cheer Up!,JiSoo N LeeWonGeun JungEunJi ChaeSooBin GoSooHee ShinJaeHa,LeeEunJin,YoonSooJung JungChanMi
24,Comedy Romance KoreanDrama Drama IdolDrama,Tvn,9.03,PG-13,Reply 1994,Baro GoAra SonHoJun YooYeonSeok JungWoo YeonJunSuk JiSeungHyun LeeIlHwa KimSungKyun MinDohee YoonJongHoon YookSungjae,ShinWonHo,LeeWooJung
16,Drama KoreanDrama,Mbc,9.47,PG-13,Thank You,JangHyuk GongHyoJin SeoShinAe ShinSungRok,LeeJaeDong,LeeKyoungHee
17,VarietyShow Entertainment,Kbs,9.28,PG-13,The Unit,Taemin Rain ChoHyunAh HwangChiYeol HyunA SanE,[],[]
26,IdolDrama KoreanDrama Thriller&Suspense Crime&Mystery Drama,Mbc,9.38,PG-13,Triangle,LeeBeomSoo BaekJinHee KimJaejoong OhYunSoo ImSiwan KimHyeEun ImHaRyong HongSukChun YeoHoMin KimSoHyun KimByungOk JungKyungSoon KangShinIl NoYoungHak KimByungGi ParkJiyeon ParkHyoJoo ShinSeungHwan KimJiYoung LeeYoonMi JoSangGoo JangDongJik WiYangHo,YuCheolYong ChoiJungKyu,ChoiWanKyu
16,Drama Romance Melodrama KoreanDrama,Tvn,8.75,PG-13,Bubblegum,LeeDongWook JungRyeoWon LeeJongHyuk ParkHeeBon BaeJongOk KimJungNan AnWooYeon LeeSeungJoon KimRiNa ParkWonSang ParkJoonGeum SeoJeongYeon ParkChulMin KimSaKwon HongEunTaek HanSeoJin(2008),KimByungSoo,LeeMiNa
6,Reality Romance VarietyShow,Tvn,9.53,PG-13,Newlywed Diary S1,KuHyeSun AhnJaeHyun,NaYoungSeok,
36,Drama KoreanDrama Historical,Mbc,9.2,PG-13,Gye Baek,JoJaeHyun OhYunSoo ChaInPyo SongJiHyo LeeSeoJin ParkEunBin KimYooSuk Hyomin LeeHyunWoo JinTaeHyun AhnKilKang LeeHanWi ParkSungWoong ParkYooHwan KimByungGi YoonDaHoon ImHyunShik JeonNoMin JungHanHun JangHeeWoong NamDaReum GoYoonHoo JoSangKi KimHyunSung KwonYongWoon KimDongHee JungSoYoung ChoiRan SeoBumShik HanJiWoo,KimGeunHong,JungHyungSoo MaChangJoon JungHaeRi
1,K-Pop VarietyShow Entertainment Lifestyle&Variety,,9.76,PG-13,BTS Comeback Show,"""KimTaehyung(BTSsV)"" J-Hope Jimin RM Jin Suga Jungkook BTS",[],[]
16,KoreanDrama Thriller&Suspense Comedy Crime&Mystery Drama,Kbs,9.44,PG-13,Queen of Mystery,KwonSangWoo ChoiKangHee JunSooJin LeeWonGeun AhnKilKang KimMinJae ParkJoonGeum JungInKi KimHyunSook HongJinKi,KimJinWoo YooYoungEun,LeeSungMin
20,KoreanDrama Romance Drama Melodrama,Kbs2,8.82,PG-13,The Thorn Birds,JooSangWook HanHyeJin SuhDoYoung KimMinJung KimHaEun ChaHwaYun SongOkSook ChoiJaeWon ParkJiIl LeeTaeRi LeeMiYoung KimSooHyun(2006),KimJongChang,LeeSunHee
16,Drama KoreanDrama Comedy Family&Kids,Kbs,7.5,G,I am Your Teacher,T.O.P ParkMinYoung YangDongGeun LeeMinHo ParkJoonGyu SonTaeYoung,KimJungKyu,LeeJinMae
133,Entertainment Music VarietyShow K-Pop,Kbs,9.05,PG-13,Immortal Songs,ShinDongYup JungJaeHyung MoonHeeJun YunMinSu Kai Kai,[],[]
12,Drama KoreanDrama WebDrama IdolDrama Horror&Supernatural,,9.27,PG-13,Nightmare Teacher,UhmKiJoon KimSoHyun LeeMinhyuk SeoShinAe BaekSeungDo KimDaYe KimJiAn HakJin,HyunMoonSub,HyunMoonSub JungYooSuk
32,Drama KoreanDrama Crime&Mystery Romance,Sbs,8.78,PG-13,Judge vs. Judge,YeonWooJin ParkEunBin DongHa HaeRyung LeeHyeEun BaeYooRam KimMinSang LeeMoonShik LeeChangWook HongSeungBum JungYeonJoo JungYooMin JiSeungHyun KimByungChoon OhNaRa ChoiJungWoo KimHeeJung WooHyun HeoJoonSuk ChoWanKi LeeDeokHwa KimHaeSook BaeHaeSun,LeeGwangYoung,SeoIn
28,Historical Romance KoreanDrama Drama,Sbs,9.32,PG-13,"Saimdang, Light's Diary",SongSeungHeon LeeYoungAe OhYoonAh LeeJooYeon LeeHaeYoung YangSeJong HongJinKi,YunSangHo,ParkEunRyeong
50,Drama KoreanDrama MedicalDrama Historical Biography,Mbc,9.11,PG-13,King’s Doctor,ChoSeungWoo LeeYoWon SonChangMin YooSun,LeeByungHoon ChoiJungKyu,KimYiYoung
56,Romance KoreanDrama Drama,Mbc,9.18,PG-13,East of Eden,ParkHaeJin HanJiHye SongSeungHeon LeeYeonHee YeonJungHoon ParkGeunHyung LeeMiSook KimBum LeeDaHae JeonMiSun ShimHyeJin ParkHaYoung NamJiHyun KwonYool HwangJungEum DennisOh JinJiHee YooDongGeun KimSungKyum JungYoungSook LeeJongWon JungHyeYoung ShinDongWoo KimHakChul ShinEunJung LeeHyoJung ParkHyunSook ParkSungWoong JoMinKi JunSoMin KangEunTak KimHyungMin YoonDongHwan GoYoonHoo ParkGunTae KwakMinSuk JungSoYoung HanYoungKwang LeeWonJae ParkChanHwan LeeSukJoon WonDukHyun JunSungHwan JungYoonSuk,KimJinMan Ashbun,NaYeonSuk LeeHongKoo
8,KoreanDrama Romance Sci-Fi&Fantasy Drama WebDrama,Mbc,9.24,PG-13,Imaginary Cat,YooSeungHo JoHyeJung HanYeRi ChoiTaeHwan Solar LeeEl KimMinSuk KimHyunJoon,LeeHyunJoo,KimGyung
41,Costume&Period Historical KoreanDrama,Kbs,8.74,PG-13,The Merchant: Gaekju 2015,YooOhSung HanChaeAh JangHyuk KimMinJung JungTaeWoo ParkEunHye,KimJongSun,KimJooYoung JungSungHee
16,KoreanDrama Drama Sci-Fi&Fantasy Action&Adventure,Kbs,9.42,PG-13,Moorim School,LeeHyunWoo SeoYeJi LeeHongbin JungYooJin ShinHyunJoon LeeBeomSoo,LeeSoYeon,KimHyunHee
68,KoreanDrama Romance Drama Women Family&Kids,Sbs,9.02,PG-13,Sister Is Alive,JangSeoHee OhYoonAh KimJooHyun KimDasom LeeJiHoon JoYoonWoo JinJiHee LeeJaeJin SonYeoEun AhnNaeSang SonChangMin SongJongHo,ChoiHyeongHun,KimSunOk
11,VarietyShow Food&Cooking Reality,Tvn,9.74,PG-13,Youn's Kitchen 2,YounYuhJung JungYuMi(1983) LeeSeoJin ParkSeoJoon,NaYoungSeok,
18,KoreanDrama Thriller&Suspense Crime&Mystery Drama,Ocn,9.5,NC-17,Voice,JangHyuk LeeHaNa KimJaeWook Yesung BaekSungHyun SonEunSeo LeeJooSeung YoonJiMin HanBoBae OhYeonAh KimHoYoung,KimHongSun,MaJinWon
16,Drama KoreanDrama Romance Comedy,Jtbc,9.26,PG-13,Fantastic,KimHyunJoo JooSangWook JiSoo KimTaeHoon ParkSiYeon KimYoungMin YoonJiWon JoJaeYoon KimJungNan LimJiKyu,JoNamKook,LeeSungEun
57,Romance Drama KoreanDrama,Mbc,8.59,PG-13,Hooray for Love,LeeBoYoung LeeTaeSung BaeJongOk KimJiHan,JooSungWoo,ParkHyeonJu
40,Drama KoreanDrama Melodrama Family&Kids,Mbc,9.06,PG-13,Goodbye to Goodbye,ChaeSiRa JoBoAh LeeSungJae JungHyeYoung LeeJunYoung JungWoongIn,KimMinSik,SoJaeWon SalGoo
18,WebDrama Crime&Mystery Comedy,,9.04,PG-13,Rebel Detectives 2,KimNamJoo(Apink) AhnHyeongSeop YooSeonHo ByungHun KimTaeMin JangMoonBok Hwarang LeeBitNa JungSuHwan YoonYongBin KimNuRi LeeJinNah JungMinKyu,ParkSunJae,
16,KoreanDrama Romance Drama,Mbc,8.91,PG-13,"I Do, I Do",LeeJangWoo KimSunAh OhMinSeok ImSooHyang ParkGunHyung YoonJooSang KimHyeEun ParkYoungGyu OhMiYun JoHeeBong OhMiHee LeeDaeYeon KimSooHyun(2006) KimMinHee,KangDaeSun,JoJungHwa
128,Comedy Entertainment Music VarietyShow,Mbc,6.27,PG-13,Radio Star,YoonJongShin KimGura KimGookJin ChaTaeHyun KyuHyun,LeeJoonIk,ChoiSukHwan
12,Drama KoreanDrama Sci-Fi&Fantasy Crime&Mystery Thriller&Suspense,Ocn,8.98,PG-13,Vampire Detective,LeeJoon OhJungSe LeeSeYoung LeeChungAh JoBokRae KimYoonHye AhnSeHa Jei KimKiMoo,KimGaRam,YooYoungSeon
12,VarietyShow Reality,Tvn,9.78,PG-13,Three Meals a Day: Seaside Ranch,LeeSeoJin EricMun YoonKyunSang LeeJongSuk LeeJongSuk HanJiMin Seolhyun LeeJeHoon,NaYoungSeok,
16,Crime&Mystery Drama IdolDrama KoreanDrama,Ocn,9.52,PG-13,Squad 38,SeoInGuk ChoiSooyoung MaDongSeok OhManSeok ParkSungWoong AhnNaeSang SongOkSook GoKyuPil JoWooJin KimSungOh JungInKi KimHongFa,KimJungMin HanDongHwa,HanJungHoon
12,WebDrama KoreanDrama Drama Sci-Fi&Fantasy,,8.08,PG-13,The Miracle,Donghyun Nahyun HakJin HongYoonHwa,KwonJinMo,AhnHoKyung
15,Romance KoreanDrama Drama,Mbc,8.99,PG-13,"Me Too, Flower!",JoMinKi HanGoEun YoonShiYoon LeeJiAh LeeGiKwang BaekSeungHwan SeoHyoRim ImHaRyong LeeByungJoon KimJiSook ParkEunJi JungManSik BaekSeungHee SonIlKwon BaekBongKi JoSungKyu,KoDongSun,KimDoWoo
32,Biography Drama KoreanDrama Costume&Period,Mbc,8.85,PG-13,"Jung Yi, the Goddess of Fire",ParkGunHyung SeoHyunJin LeeSangYoon MoonGeunYoung KimBum JungBoSuk SungJiRu LeeKwangSoo JunKwangRyul HanGoEun AhnSukHwan JangGwang,ParkSungSoo JungDaeYoon,KwonSoonGyu LeeSeoYoon
16,Action&Adventure KoreanDrama,Kbs,8.3,PG-13,The Man in the Mask,JooSangWook KimSunAh UhmKiJoon JunKwangRyul NoYoungHak ParkYoungGyu LeeMoonShik LeeKiYoung HwangSunHee JungAeRi,JeonSan,ChoiJinWon
36,Drama KoreanDrama,Mbc,9.51,PG-13,Scandal: A Shocking and Wrongful...,KimJaeWon JoYoonHee KiTaeYoung KimKyuRi JoJaeHyun ParkSangMin JoHwiJoon HanKiWon AhnSukHwan ChoiChulHo HongYeoJin YangJinWoo ParkMinWoo ShinEunKyung HanGroo JungJoonWon JoHanChul JungKyuSoo JoMinAh KimHyeRi JungYoonSuk JungHoKeun ChoiYongMin ParkJungChul,KimJinMan ParkJaeBum,BaeYooMi
23,Drama Historical KoreanDrama Melodrama,Kbs,9.01,PG-13,The King’s Face,LeeSungJae KimKyuRi SeoInGuk JoYoonHee ShinSungRok SongMinHyung AhnSukHwan LeeKiYoung GoInBum JooJinMo(1958) ChoiChulHo LimJiKyu LeeByungJoon LeeSoonJae OhEunHo KimHeeJung(1992) ImJiEun WonDukHyun ParkJoonMok BaekJaeJin KimYul ParkJooHyung,YunSeongSik,LeeHyangHee
16,KoreanDrama Family&Kids Drama,Kbs,9.63,PG-13,Oh My Geum Bi,OhJiHo ParkJinHee HeoJungEun LeeJiHoon(1979) OhYoonAh KangSungJin,KimYoungJo,JeonHoSung
50,Music Romance KoreanDrama Drama,Mbc,9.14,PG-13,Gloria,LeeChunHee BaeDoona SeoJiSeok HaYunJoo SoYiHyun MinJoonHyun LeeSungMin OhHyunKyung ChoiJaeHwan LeeJongWon KimYoungOk LeeYoungHa SungByungSook NaYoungHee ParkHyunSook JoHyangKi LeeJiEun JungSoNyu KimKiHyun LeeSangWoo(1963) YunKyuJin ChunBoGeun,KimMinSik KimKyungHee,JungJiWoo
8,VarietyShow Entertainment Music Dance,Kbs,9.43,PG-13,Dancing High,LeeGiKwang LeeHoWon LeeSeungHoon LiaKim JeongHyeongDon Jisung(NCTDREAM),[],[]
11,Action&Adventure KoreanDrama Crime&Mystery Drama,Ocn,9.69,PG-13,Bad Guys,ParkHaeJin KimSangJoong MaDongSeok JoDongHyuk KangYeWon KangShinIl MinJiAh HwangSeungEon ParkJungHak KimTaeHoon,KimJungMin,HanJungHoon
16,Food&Cooking Romance KoreanDrama Comedy Drama,ChannelA,8.75,PG-13,Panda and Hedgehog,Donghae YooSoYoung ChoiJinHyuk YoonSeungAh SonJiHyun(1990),LeeMinCheol,HanJoonYoung
16,KoreanDrama Melodrama Drama,Tvn,9.7,PG-13,Memory,LeeSungMin KimJiSoo Junho YoonSoHee ParkJinHee LeeKiWoo YeoHoeHyun NamDaReum SongSunMi LeeJungGil BanHyoJung ParkJoonGeum JangGwang JeonNoMin ShinJaeHa SongJiIn,ParkChanHong,KimJiWoo
24,Melodrama Drama KoreanDrama Costume&Period Biography Historical Romance,Kbs,8.97,PG-13,Hwangjini,HaJiWon KimJaeWon JangGeunSuk WangBitNa RyuTaeJoon KimYoungAe,KimCheolKyu,YoonSunJoo
18,Drama MedicalDrama KoreanDrama Romance,Sbs,9.11,PG-13,The Gang Doctor,JooWon KimTaeHee StephanieLee JoHyunJae ChoiMin AhnSeHa MinJinWoong JangGwang ChaeJungAn JungWoongIn BaeHaeSun YooJunHong,OhJinSeok,JangHyeokRin
16,Comedy KoreanDrama Action&Adventure Drama Romance,Kbs,8.99,PG-13,Secret Agent Miss Oh,KimSangKyung ParkHyoJoo HyunWoo LeeSooKyung RyuJin Horan,KimJungKyu,ChoiLeeRang LeeJinMae
50,KoreanDrama Romance Drama,Mbc,8.96,PG-13,Assorted Gems,LeeHyunJin KoNaEun LeeTaeGon JungYuMi(1984) SoYiHyun KimYoungOk JungHyeSun OhMiHee WonJongRye KimKwangGyu ParkGeunHyung YoonJongHwa HongSukChun YangYoungJoon HanJinHee LeeSeoBin LeeIlMin ShinShinAe SeoWooRim HanHyeSook ChoiJaeHo HanJiHoo ChoiAhJin SeoDongSoo SeolWoonDo MichaelBlunck,BaekHoMin,ImSungHan
54,KoreanDrama Drama,Mbc,8.93,PG-13,Twinkle Twinkle,KangDongHo LeeYooRi KimSukHoon KimHyunJoo KilYongWoo GoDooShim JungTaeWoo JangYong ParkYooHwan KimHyungBum LeeAhHyun KimSangHo ShinSooYun WonKiJoon KimJiYoung HanJiWoo,NoDoCheol,BaeYooMi
60,Drama KoreanDrama Melodrama,Sbs,9.49,PG-13,Giant,LeeBeomSoo HwangJungEum JooSangWook ParkJinHee JiYoo KimSooHyun ParkSoYeon SonByungHo NoYoungHak YooHyungKwan LeeSeungHyung KimJungHyun ParkSangMin LeeHyoJung SongKyungChul LeeKiYoung MinJoonHyun ImHyuk ParkHaYoung KimSeoHyung JungBoSuk JungKyuSoo MoonJiIn ChoiHaNa HongYeoJin HanKyungSun YoonYooSun MoonHeeKyung JunJinGi LeeEunJung KimHakChul YoonYongHyun ChoiMin KimSungOh YeoJinGoo LeeMoonShik ShinSeungHwan NamJiHyun LeeDeokHwa KimGaEun,YuInSik LeeChangMin,JangYoungCheol JungKyungSoon
32,KoreanDrama Costume&Period Biography Drama,Mbc,9.32,PG-13,Kim Soo Ro,KoJooWon SeoJiHye JiSung YooOhSung LeePilMo KimHyeEun BaeJongOk YoonJooSang JunJinGi KangShinIl JooHo KimHyungBum LeeJongWon LeeHyoJung KangByul LeeWonJong BaekSoMi ChoiSooRin LeeDukHee ChoiAhJin KimKiHyun HanMinChae KimHyungIl JungJaeGon SeoIlHyun ShinDongKi JangDongJik ChoiHwaJung ChaeBin WonDukHyun ParkGunTae,ChoiJongSu JangSooBong,KimMiSuk
50,Drama KoreanDrama Family&Kids Comedy,Mbc,7.67,PG-13,Man Who Sets the Table,OnJooWan ChoiSooyoung ParkJinWoo SeoHyoRim ShimHyungTak LeeIlHwa KimMiSook KimKapSoo KimSooMi LeeJungHyuk LeeChulMin LeeSeYoung(1989) HongSeoJoon KimJiSook SongKang HanGaRim TaeHangHo,JooSungWoo,ParkHyeonJu
20,KoreanDrama Crime&Mystery Drama Thriller&Suspense,Sbs,9.28,PG-13,Ghost,DanielChoi LeeYeonHee UhmKiJoon SongHaYoon SoJiSub KwakDoWon BaeMinHee LeeKiYoung Esom YoonJiHye BaekSeungHyun KwonHaeHyo ParkJiIl ChoiJungWoo HanBoBae LimJiKyu KwakJiMin LeeJaeYoon JungMoonSung G.O JungDongHwan,KimHyeongSik ParkShinWoo,KimEunHee
32,Crime&Mystery Thriller&Suspense Drama KoreanDrama,Sbs,9.18,PG-13,Secret Mother,SongYoonAh KimSoYeon KimTaeWoo SongJaeRim ChaHwaYun OhYeonAh SeoYoungHee MinSungWook KimByungOk,ParkYongSoon,HwangYeJin
8,IdolDrama WebDrama Romance KoreanDrama,,8.63,PG-13,Hot and Sweet,ChoiMinHwan Yuna,[],[]
16,Drama KoreanDrama Crime&Mystery Thriller&Suspense,Kbs,8.82,PG-13,Queen of Mystery 2,KwonSangWoo ChoiKangHee ParkByungEun LeeDaHee KimJongSoo KimMinSang(1968) HongKiJoon KimWonHae JangYooSang KimHyunSook KimTaeWoo MinSungWook OhMinSeok DinDin,ChoiYoonSuk,LeeSungMin
16,KoreanDrama Crime&Mystery Drama Romance,Tvn,8.64,PG-13,My Secret Hotel,KimJiHan YooInNa ChoiJungWon LeeYoungEun NamgoongMin HwangSoHee ChoiTaeHwan KimBoMi ChoiJungWoo KimDongGyoon UhmSooJung HaYunJoo AhnKilKang,HongJongChan,KimYeRi KimDoHyun
16,KoreanDrama Romance Drama,Mbc,9.15,PG-13,Woman With a Suitcase,ChoiJiWoo JooJinMo LeeJoon JeonHyeBin ChoiTaeHwan OhYeonAh,KwonSeokJang,KwonEumMi
16,Comedy KoreanDrama Romance Drama,Tvn,9.17,PG-13,Twenty Again,ChoiJiWoo LeeSangYoon KimMinJae(1996) ChoiWonYoung ParkHyoJoo ChoiYoonSo NoYoungHak HaSeungRi KimHeeChan KangTaeOh JungSooYoung BanHyoJung KimKangHyun JinKiJoo ImJiHyun SonNaeun,KimHyungShik,SoHyunKyung
12,Thriller&Suspense Crime&Mystery Drama KoreanDrama,Jtbc,9.58,PG-13,Solomon’s Perjury,KimHyunSoo JangDongYoon SeoJiHoon SeoYoungJoo JoJaeHyun BaekChulMin SeoShinAe HakJin AhnNaeSang KimYeoJin KimSoHee,KangIlSoo,MiyukiMiyabe KimHoSoo
355,Entertainment Lifestyle&Variety Music VarietyShow,ArirangTv,8.69,PG-13,After School Club,ParkJiMin HanHeeJun Seungmin YookSungjae YookSungjae KimDasom Jackson Jinyoung(B1A4) YookSungjae KimDasom Jackson Jinyoung(B1A4) JB Baro LeeMinhyuk AmberLiu,[],[]
26,KoreanDrama Drama Romance Melodrama,Sbs,8.75,PG-13,My Heart Twinkle Twinkle,OhChangSuk NamBoRa BaeSooBin JangShinYoung LeePilMo HaJaeSook SonEunSeo LeeDeokHwa JungEunWoo YoonDaHoon LeeTaeIm,OhSeGang,JoJungSun
16,Drama KoreanDrama Melodrama,Kbs,8.79,PG-13,"I’m Sorry, I Love You",SoJiSub ImSooJung JungKyungHo ChoiYeoJin LeeHyeYoung(1962) LeeYoungHa,KimJongSik LeeHyeongMin,LeeKyoungHee
30,Music KoreanDrama Drama Romance Melodrama,Sbs,9.0,PG-13,Five Fingers,JooJiHoon JinSeYeon JiChangWook ChaeSiRa KangYiSuk JoMinKi OhDaeGyu JungJoonHa JeonGookHwan JungEunWoo JeonNoMin LeeHaeIn NaMoonHee KangChanYang JeonMiSun ChaHwaYun JangHyunSung,ChoiHyeongHun,KimSunOk
12,KoreanDrama Thriller&Suspense Crime&Mystery,Tvn,9.4,PG-13,Liar Game,JoJaeYoon ChaSooYun LeeSangYoon KimSoEun ShinSungRok JangSeungJo LeeEl LeeChulMin KimIkTae KimYoungAe ChoiYoonSo UhmHyoSup ChoiJinHo,HiroakiMatsuyama AyakoOki YasushiUeda,ShinobuKaitani OshoFuruya
20,KoreanDrama Romance Drama,Sbs,9.13,PG-13,Second to Last Love,JiJinHee KimHeeAe KwakSiYang KimSeulGi StephanieLee KimKwon LeeSooMin,ChoiHyeongHun,ChoiYoonJung
23,MedicalDrama KoreanDrama Drama,Mbc,8.67,PG-13,Golden Time,LeeSunGyun HwangJungEum LeeSungMin SongSunMi HongJiMin LeeKiYoung KimMiKyung UhmHyoSup KimSaKwon KimKiBang SunwooYongNyeo JiIlJoo JungKyuSoo ShinDongMi ParkJungMin JungSukYong NaSeungHo JoSangKi ParkYoungJi,KwonSeokJang LeeYoonJung,ChoiHeeRa
16,Romance Comedy Drama KoreanDrama Melodrama,Mbc,9.06,PG-13,Which Star Are You From,KimRaeWon JungRyeoWon ParkShiHoo KangJungHwa KimHaKyoon ImYeJin,PyoMinSoo,JungYooGyung
20,Drama Family&Kids KoreanDrama Romance,Kbs,8.43,PG-13,Perfect Wife,KoSoYoung YoonSangHyun JoYeoJeong SungJoon ImSeMi N LeeYoungE NamGiAe JungSooYoung InGyoJin KimKyuChul KimJungNan,HongSeokKu,YoonKyungAh
